question	Category
how many bank branches closes in us in 2020	Numerical Search
Numerical Searchber of bank mergers in 2020	Numerical Search
how many banks in conneticut	Numerical Search
how many bank branches does chase bank have	Numerical Search
how many bonds did goldman sachs issue in 2019	Numerical Search
How many branches does Chase bank have in Connecticut	Numerical Search
How many branches does Chase bank have in New York	Numerical Search
how many branches does Chase have in New York	Numerical Search
how many branches does Citibank have in New York	Numerical Search
how many online only retail banks in the US	Numerical Search
bank branches reduction in 2020	Numerical Search
how many bank branches are there in nevada?	Numerical Search
top oil producers in united states	Ranking Search
What are the top oil fracking locations in the united states?	Ranking Search
most successful retail bank in Maine	Ranking Search
what bank worked on the most IPOs in 2021	Ranking Search
what is a bank that does a lot of mortgage lending	Ranking Search
what was the leading bank for IPOs in 2019	Ranking Search
what's the biggest bank in the US	Ranking Search
what's the biggest wealth management firm in the us	Ranking Search
what's the biggest wealth management firm in the us by aum	Ranking Search
what's the largest bank in the US	Ranking Search
which banks did the most M&A business in 2021	Ranking Search
Who is the largest bank in connecticut?	Ranking Search
what are the largest US banks by assets	Ranking Search
Which U.S. bank has the highest deposit market share?	Ranking Search
Which U.S. bank was the originator of the highest mortgage loan volume in 2020?	Ranking Search
banks with loan growth	General Search
west coast banks	General Search
what is BNPL	Specific Search
where is bitcoin trading	Specific Search
how is the 10 yr treasury today	Specific Search
is there any m&a activity in oil	Specific Search
verizon and 5g	General Search
what are analysts saying about verizon and 5g	Specific Search
M&A activity in oil	Specific Search
goldman sachs q3 net interest income	Information Search
how are fed interest rate reductions going to impact banks?	Deep Search
how are interest rate reductions going to impact banks?	Deep Search
huntington bancshares ceo	Specific Search
recent executive changes	General Search
what banks have recently been acquired?	Specific Search
what interest rate assumptions are banks building into their earnings guidance?	Specific Search
which banks are contemplating acquisitions?	Specific Search
which banks are discussing acquiring other banks?	Specific Search
which banks are discussion fintech competition?	Specific Search
which banks ipo'd in 2021?	Specific Search
who acquired banks in 2021?	Specific Search
who is hban's ceo	Specific Search
who is huntington bancshare's ceo?	Specific Search
who is reporting earnings next week?	Specific Search
who is talking about consolidating bank branches?	Specific Search
crypto strategy	General Search
jpmorgan 10K	Information Search
which banks are discussing crypto	Specific Search
who discussed acquisitions last quarter?	Specific Search
who missed revenue last quarter?	Specific Search
net interest margin at USB	Information Search
nonaccrual loans at mtb	Information Search
autonomous	General Search
autonomous vechiles	General Search
self drive cars	General Search
when does Apple next Quarter start?	Specific Search
when does Apples next Quarter start?	Specific Search
american express discount rate	Information Search
axp discount rate	Information Search
commercial loans at wells fargo	Specific Search
directors of signature bank	Specific Search
fdic	General Search
deposit growth at catc	Information Search
inside ownership at sbny	Specific Search
interest rate sensitivity at cfg	Information Search
larry seidman	Specific Search
loan growth at bank of america	Information Search
net charge offs at bank of america	Information Search
net interest margin at pnc	Information Search
Numerical Searchber of PNC branches	Numerical Search
regions  net charge offs	Information Search
regions bank net charge offs	Information Search
seidman	Specific Search
spend volumes at american express	Information Search
spend volumes at axp	Information Search
total commercial loans at wells fargo	Information Search
us bank deposit growt	Specific Search
us bank deposit growth	Specific Search
what does jaime dimon say about crypto	Specific Search
who is talking about crypto	Specific Search
where can i find tier 1 capital ratio	Specific Search
which banks have branches closest to buffalo new york	Specific Search
oil price in permian basin	Information Search
price of oil	Specific Search
What oil well are in the permian basin?	Specific Search
What oil wells are in the permian basin?	Specific Search
Bank of America EPS 2021	Information Search
How big is Chase bank	Specific Search
What are Chase bank's subsidiaries	Information Search
what are current mortgage lending rates from citibank	Information Search
what do banks do	General Search
Where are Chase bank's subsidiaries	Information Search
which banks failed in 2008	Specific Search
which banks merged in 2021	Specific Search
which banks were responsible for the economic crisis of 2008	Specific Search
how is the oil sector doing	General Search
how is the oild sector doing	General Search
what is the price of oil	General Search
Who are the GSIBS?	Specific Search
Who's talking about Basel IV?	Specific Search
Why is M&T merging with Peoples?	Specific Search
2022 guidance	General Search
acquisition plans	General Search
bank cre guidance	General Search
deposit betas	General Search
NIM trends	General Search
what are bank crypto plands	Specific Search
what are bank crypto plans	Specific Search
what are bank loan growth expectations	Specific Search
Are banks investing in cryptocurrencies?	Specific Search
Aside from Credit Risk, what are the additional types of risk a bank is exposed to?	Specific Search
are banks adopting decentralized finance?	Specific Search
How are banks adopting DeFi?	Deep Search
How are banks incorporating blockchain technology?	Deep Search
How are projected cash flows calculated for a bank through a discounted cashflow (DCF) model?	Deep Search
How can a bank's credit risk be quantified?	Deep Search
How can a bank's liquidity health be measured from their balance sheet?	Deep Search
How can you determine the amount of Risk-Weighted assets held by a bank?	Deep Search
How does a Bank make money through assets and liabilities, such as loans and deposits?	Deep Search
How does a bank's credit risk standing effect interest rates for their capital?	Deep Search
How does a Nonperforming Loan become a Reperforming Loan?	Deep Search
How is a bank's Capital Adequacy Ratio calculated?	Deep Search
How is a bank's efficiency ratio calculated?	Deep Search
How is a bank's Loan-To-Deposit ratio calculated?	Deep Search
How is a bank's Net Interest Income calculated?	Deep Search
How is a bank's Solvency Ratio calculated?	Deep Search
How is DeFi disrupting the banking industry?	Deep Search
What are considered liquid assets on a banks balance sheet?	Specific Search
What are the different types of Nonperforming Loans (NPLs)?	Specific Search
what are the largest banks in the US	Ranking Search
What assest and expenses are considered interest bearing for a bank?	Specific Search
What does a bank's stress test peformance history look like, both currently and historically?	Specific Search
What is the most important asset on a bank balance sheet?	Specific Search
What is the significance of a bank's capital tiers, such as tier 1 and tier 2 capital?	Specific Search
What line items are considered Tier-1 Capital?	Specific Search
What valuation multiples and metrics are most important when performing comparable analysis across banks?	Specific Search
Why is shareholder equity an important metric for assessing leverage and loan risk?	Specific Search
What does the Herfindahl-Hirschman Index (HHI) represent?	Specific Search
Which banks are considered to be part of the bulge bracket?	Specific Search
did the Numerical Searchber of bank branches grow or shrink in 2021?	Numerical Search
did the Numerical Searchber of bank of hawaii branches grow or shrink in 2021?	Numerical Search
is the Numerical Searchber of bank branches for huntington bancshares increasing or decreasing?	Numerical Search
300 bp improvement in ROTCE	Unknown Intent
8QUHDOL]HGORVVHVRQLQYHVWPHQWVHFXULWLHVDYDLODEOHIRUVDOH	Unknown Intent
abbb Outstanding issuances	Unknown Intent
abbb Outstanding issuances of perpetual preferred stock	Unknown Intent
alerus annual report	Information Search
Alerus annual report	Information Search
allowance for credit losses	Specific Search
allowence for credit losses	Specific Search
Are banks investing in cryptocurrencies?	Specific Search
autonomous	General Search
autonomous vechiles	General Search
bancorp net income	Information Search
bandicorp earnings	Information Search
bank branches reduction in 2020	Specific Search
Bank of America EPS 2021	Information Search
banks with loan growth	Specific Search
bnpl	General Search
citibank earnings	Information Search
citigroup earnings	Information Search
citigroup revenue	Information Search
Citigroup revenue	Information Search
company net income	General Search
core values of goldman sachs	Specific Search
corparate banking	General Search
corporate banking	General Search
corporate planning	General Search
did the Numerical Searchber of bank branches grow or shrink in 2021?	Specific Search
Earning presentation	General Search
earnings	General Search
Exton, Pennsylvania Branch	Specific Search
finance	General Search
Finance	General Search
five star bancorp commercial lending	Information Search
five star bancorp Loan Portfolio Composition	Information Search
Funding secured by level 2A liquid assets	Information Search
goldman sachs q3 net interest income	Information Search
gross income	General Search
HBAN FR	Information Search
HBAN FR Y-9LP	Information Search
hban net income	Information Search
HBAN regulatory	Information Search
hban revenue	Information Search
heartland	General Search
hello dan	Unknown Intent
hi dan	Unknown Intent
How are banks adopting defi	Deep Search
How are banks adopting DeFi?	Deep Search
how are fed interest rate reductions going to impact banks?	Deep Search
how are interest rate reductions going to impact banks?	Deep Search
How are loans evaluated in TEB bancorp	Deep Search
how big is chase bank	Deep Search
How can I get more money	General Search
how is a banks solvency ratio calculated?	Specific Search
how is an emerging growth company indicated	Specific Search
How is an emerging growth company indicated	Specific Search
how is the 10 yr treasury today	Deep Search
How is the 10 yr treasury today	Deep Search
How is the Q3 performance of the suncrest bank	Information Search
how many bank branches are there in nevada	Numerical Search
how many bank branches are there in nevada?	Numerical Search
how many bank branches closes in us in 2020	Numerical Search
how many bank branches does chase bank have	Numerical Search
how many banks in conneticut	Numerical Search
how many bonds did goldman sachs issue in 2019	Numerical Search
How many branches does Chase bank have in Connecticut	Numerical Search
How many branches does Chase bank have in New York	Numerical Search
how many branches does Chase have in New York	Numerical Search
How many branches does citibank have	Numerical Search
how many branches does Citibank have in New York	Numerical Search
how many branches does citibank have in New york?	Numerical Search
How many branches does citibank have in new york?	Numerical Search
How many branches does morgan stanley have	Numerical Search
how many online only retail banks in the US	Numerical Search
hubbell net income	Information Search
huntington bancshares ceo	Specific Search
Huntington bancshares inc ffiec 101	Information Search
Huntington Bancshares Inc FFIEC 101	Information Search
Investments in own tier 2 capital instruments for Morgan Stanley	Information Search
is competition causing loan spreads to widen or compress	Deep Search
is hban considering acquisition	Specific Search
is ozark considereing acquisition	Specific Search
Is ozark considereing acquisition	Specific Search
is ozark considering acquisition	Specific Search
Is ozark considering acquisition	Specific Search
is there any m&a activity in oil	Specific Search
jp morgan personnel	General Search
jp morgan stocks	General Search
jpm earnings	General Search
jpm personnel	General Search
jpm revenue	Information Search
jpmorgan	General Search
Jpmorgan	General Search
Loan Rollforward	General Search
M&A activity in oil	Specific Search
most successful retail bank in Maine	Ranking Search
my net income	General Search
net income	General Search
net incomes	General Search
Numerical Searchber of bank mergers in 2020	Numerical Search
old national net income	Information Search
Other deductions from additional tier 1 capital for morgan stanley	Information Search
Outstanding issuances of perpetual preferred stock	Information Search
recent executive changes	General Search
revenue	General Search
Revenue	General Search
self drive cars	General Search
ssb bancorp	Information Search
ssb bancorp earnings	Information Search
ssb bancorp From parent holding company	Information Search
sugar creek financial	Information Search
sunnyside income	Information Search
Sunnyside income	Information Search
tell me about acquisitions	General Search
tell me about fintech	General Search
tell me about jp morgan	General Search
tell me about jpmorgan	General Search
tell me about stocks	General Search
Tell me about the acorn project	General Search
test logging with v1	General Search
the net income	General Search
this year represents a third consecutive year of acceptable earnings	General Search
Top 20 fastest growing banks in the USA	Ranking Search
top oil producers in united states	Ranking Search
top oil producers in united states what bank worked on the most IPOs in 2021	Ranking Search
tristate	General Search
tristate fintech	General Search
unrealized losses on investment securities available	Deep Search
verizon and 5g	General Search
VERSAILLES FINANCIAL CORPORATION	General Search
VERSAILLES FINANCIAL CORPORATION Directors' fees	Information Search
We focus primarily on commercial lending	General Search
we have lines in the water	General Search
west coast banks	General Search
what's the biggest bank in the US	Ranking Search
What's the biggest bank in the us	Ranking Search
what's the biggest wealth management firm in the us	Ranking Search
what's the biggest wealth management firm in the us by aum	Ranking Search
what's the largest bank in the US	Ranking Search
what are analysts saying about verizon and 5g	Deep Search
What are banks saying about loan pricing and structure trend?	Deep Search
What are banks saying about loan pricing and structure trends	Deep Search
What are banks saying about loan pricing and structure trends?	Deep Search
What are Chase bank's subsidiaries	Deep Search
What are companies saying about capital spending plans?	Deep Search
What are companies saying about capital spending plans? Or more broadly, the allocation of capital.	Deep Search
what are electric utilities sayng about green hydroGeneral Search	Deep Search
what are the current mortage lending interests?	Deep Search
what are the largest US banks by assets	Ranking Search
What are the top oil fracking locations in the united states	Ranking Search
What are the top oil fracking locations in the united states?	Ranking Search
What are they saying about loan pricing and structure trends	Deep Search
what bank worked on the most IPOs in 2021	Ranking Search
what banks are contemplating acquisitions	Deep Search
what banks are contemplating being acquired	Specific Search
what banks are discussing fintech	Specific Search
What banks are discussing fintech	Specific Search
What banks are discussing FinTech	Specific Search
what banks are discussing fintech competition	Specific Search
what banks are discussing Fintech competition	Specific Search
What banks are discussing fintech competition	Specific Search
What banks are discussing FinTech competition	Specific Search
What banks are discussing fintech competition/partnerships/developments?	Specific Search
What banks are discussing FinTech competition/partnerships/developments?	Specific Search
what banks are discussing Fintech competition?	Specific Search
What banks are discussing fintech competition?	Specific Search
What banks are discussing FinTech competition?	Specific Search
what banks are discussing Fintech competition?/	Specific Search
what banks are discussing Fintech development	Specific Search
what banks are discussing Fintech developments	Specific Search
What banks are discussing FinTech developments	Specific Search
What banks are discussing FinTech developments?	Specific Search
what banks are discussing Fintech partnership	Specific Search
what banks are discussing Fintech partnership?	Specific Search
What banks are discussing FinTech partnerships	Specific Search
What banks are discussing FinTech partnerships?	Specific Search
what banks are talking about fintech competition	Specific Search
What banks are talking about fintech competition	Specific Search
what banks have recently been acquired?	Specific Search
What companies are discussing fintech competition	Specific Search
What companies are discussing fintech competition?	Specific Search
what companies are discussing Fintech partnership?	Specific Search
What companies are discussing fintech partnership?	Specific Search
what did citi say about crypto	Deep Search
what did citibank say about fintech	Deep Search
what did Citibank say about fintech	Deep Search
What did citibank say about fintech	Deep Search
What did citigroup say about fintech	Deep Search
what did first citibank say about fintech	Deep Search
what did first citibank say about interest rates	Deep Search
what did first horizon say about fintech	Deep Search
WHAT DID Gouverneur Bancorp ANNOUNCE	Deep Search
what did jp morgan say about crypto	Deep Search
what did jp morgan say about earnings	Deep Search
What did jp morgan say about earnings	Deep Search
what did jp morgan say about fintech	Deep Search
what did jpm say about earnings	Deep Search
what did jpmorgan say about acquisitions	Deep Search
What did jpmorgan say about acquisitions	Deep Search
what did jpmorgan say about fintech	Deep Search
What did jpmorgan say about fintech	Deep Search
what did jpmorgan say about pension plans	Deep Search
What did my competition say about green hydroGeneral Search	Deep Search
what do banks do	General Search
What do banks do	General Search
what do people think about crypto	Deep Search
what does a bank do	General Search
What does a bank do	General Search
What does the Herfindahl-Hirschman Index (HHI) represent?	Specific Search
what interest rate assumptions are banks building into their earnings guidance	Deep Search
What interest rate assumptions are banks building into their earnings guidance	Deep Search
what interest rate assumptions are banks building into their earnings guidance?	Deep Search
What interest rate assumptions are banks building into their earnings guidance?	Deep Search
What interest rate assumptions is Huntington Bancshares Incorporated building into their earnings guidance?	Deep Search
what is a bank that does a lot of mortgage lending	Specific Search
what is biden ev plan	Specific Search
what is BNPL	Specific Search
what is citigroup saying about crypto	Deep Search
what is citigroup saying about fintech	Deep Search
what is eaton's 2022 growth outlook?	Information Search
What is eaton's 2022 growth outlook?	Information Search
What is HBAN saying about loan pricing and structure trend?	Deep Search
what is Huntington Bancshares Inc Factsheet	Information Search
What is huntington bancshares inc factsheet	Information Search
what is Huntington Bancshares Inc FFIEC 101	Information Search
what is Huntington Bancshares Inc income from bank subsidaries?	Information Search
What is the capital stress testing done by invictus in county bancorp	Deep Search
What is the cause of revenue increase	General Search
what is the deposit market of the community bank based in chester	Deep Search
What is the deposit market of the community bank based in chester	Deep Search
what is the largest bank in US?	Ranking Search
what is the wholesale exposure risk for morgan stanley	Specific Search
what is tristate saying about acquisition	Deep Search
What is tristate saying about acquisition	Deep Search
what is tristate saying about fintech	Deep Search
What is tristate saying about fintech	Deep Search
What is WASHINGTON BUSINESS BANK	General Search
WHAT IS WASHINGTON BUSINESS BANK	General Search
What strategies are banks developing around cryptocurrencies	Deep Search
What strategies are banks developing around cryptocurrencies/distributed ledgers?	Deep Search
what strategies are banks developing around cryptocurrencies?	Deep Search
What strategies are banks developing around cryptocurrencies?	Deep Search
What strategies is park national bank developing around cryptocurrencies/distributed ledgers?	Deep Search
What strategies is Park National Bank developing around cryptocurrencies/distributed ledgers?	Deep Search
What strategies is prk developing around cryptocurrencies/distributed ledgers?	Deep Search
What strategies is PRK developing around cryptocurrencies/distributed ledgers?	Deep Search
what was said about crypto	General Search
What was said about crypto	General Search
what was the leading bank for IPOs in 2019	Ranking Search
when does Apple next Quarter start?	Specific Search
when does Apples next Quarter start?	Specific Search
when was Huntington Bancshares founded	Specific Search
When was morgan stanley incorporated	Specific Search
when was sunnyside bancorp incorporated in the state of maryland	Specific Search
Where are Chase bank's subsidiaries	Specific Search
where is bitcoin trading	Specific Search
where is Huntington bancshares headquarted?	Specific Search
Where is the best pizza	Specific Search
where was Huntington Bancshares founded	Specific Search
which are the top 20 fastest growing banks in the USA	Ranking Search
which banks acquired companies in 2021?	General Search
Which banks acquired companies in 2021?	General Search
Which banks are considered to be part of the bulge bracket?	General Search
which banks are contemplating acquisition	General Search
which banks are contemplating acquisitions	General Search
Which banks are contemplating acquisitions	General Search
Which banks are contemplating being acquired	General Search
Which banks are contemplating being acquired?	General Search
Which banks are discussing FinTech competition	General Search
which banks are discussing mergers	General Search
Which banks are discussing mergers	General Search
which banks are discussion fintech competition?	General Search
Which banks are talking about fintech competition	General Search
Which banks are talking about FinTech competition	General Search
which banks did the most M&A business in 2021	Ranking Search
which banks failed in 2008	General Search
which companies are contemplating being acquired	General Search
Which companies are contemplating being acquired	General Search
Which companies are discussing fintech?	General Search
Which companies are discussing Fintech?	General Search
Which U.S. bank has the highest deposit market share	Ranking Search
Which U.S. bank has the highest deposit market share?	Ranking Search
Which U.S. bank was the originator of the highest mortgage loan volume in 2020	Ranking Search
who is taking about consolidating bank branches?	General Search
Who is taking about consolidating bank branches?	General Search
Who is taking about consolidating branches?	General Search
who is talking about consolidating bank branches	General Search
Who is talking about consolidating bank branches	General Search
who is talking about consolidating bank branches?	General Search
Who is talking about consolidating bank branches?	General Search
Who is the largest bank in connecticut	Ranking Search
Who is the largest bank in connecticut?	Ranking Search
who mentioned crypto	General Search
who mentioned cryptocurrency	General Search
Who mentioned cryptocurrency	General Search
Who mentioned earnings	General Search
